{
  "schema_version": "udh.work-plan/1",
  "plan_id": "plan-demo",
  "session_id": "session-demo",
  "revision": 1,
  "spec_digest": "sha256:aaaaaaaaaaaaaaaaaaaaaaaaaaaaaaaaaaaaaaaaaaaaaaaaaaaaaaaaaaaaaaaa",
  "snapshot_digest": "sha256:bbbbbbbbbbbbbbbbbbbbbbbbbbbbbbbbbbbbbbbbbbbbbbbbbbbbbbbbbbbbbbbb",
  "policy_digest": "sha256:cccccccccccccccccccccccccccccccccccccccccccccccccccccccccccccccc",
  "release_digest": "sha256:aaaaaaaaaaaaaaaaaaaaaaaaaaaaaaaaaaaaaaaaaaaaaaaaaaaaaaaaaaaaaaaa",
  "requirement_ids": [
    "DEMO-REQ-1"
  ],
  "scope": {
    "workspace_id": "workspace-demo",
    "read": [
      "src/parser.py",
      "tests/test_parser.py"
    ],
    "create": [],
    "write_existing": [
      "src/parser.py",
      "tests/test_parser.py"
    ],
    "delete": [],
    "deny": [
      ".git",
      "secrets"
    ],
    "recipe_ids": [
      "python_tests",
      "python_lint"
    ],
    "network": "none",
    "network_allowlist": []
  },
  "work_units": [
    {
      "task_id": "task-1",
      "objective": "빈 CSV 입력을 빈 행 목록으로 반환하되 기존 정상 입력을 보존한다.",
      "requirement_ids": [
        "DEMO-REQ-1"
      ],
      "decision_ids": [
        "decision-1"
      ],
      "scenario_ids": [
        "scenario-empty",
        "scenario-normal"
      ],
      "depends_on": [],
      "input_artifacts": [
        {
          "artifact_id": "artifact-demo",
          "digest": "sha256:aaaaaaaaaaaaaaaaaaaaaaaaaaaaaaaaaaaaaaaaaaaaaaaaaaaaaaaaaaaaaaaa",
          "media_type": "text/plain"
        }
      ],
      "expected_preimage_digest": "sha256:bbbbbbbbbbbbbbbbbbbbbbbbbbbbbbbbbbbbbbbbbbbbbbbbbbbbbbbbbbbbbbbb",
      "scope": {
        "workspace_id": "workspace-demo",
        "read": [
          "src/parser.py",
          "tests/test_parser.py"
        ],
        "create": [],
        "write_existing": [
          "src/parser.py",
          "tests/test_parser.py"
        ],
        "delete": [],
        "deny": [
          ".git",
          "secrets"
        ],
        "recipe_ids": [
          "python_tests",
          "python_lint"
        ],
        "network": "none",
        "network_allowlist": []
      },
      "preconditions": [
        "src/parser.py와 tests/test_parser.py가 입력 snapshot과 일치한다."
      ],
      "steps": [
        {
          "step_id": "step-1",
          "instruction": "기존 parser와 테스트를 읽고 빈 입력 사례를 기존 테스트 파일에 추가한다.",
          "expected_observation": "수정 전 재현 여부 및 실패 근거가 기록된다."
        },
        {
          "step_id": "step-2",
          "instruction": "빈 입력 처리만 수정한 뒤 전체 관련 테스트와 lint를 실행한다.",
          "expected_observation": "기존 정상 입력과 빈 입력의 검사가 모두 통과한다."
        }
      ],
      "interface_changes": [],
      "error_handling": [
        "기존 인코딩 오류 처리 방식은 변경하지 않는다."
      ],
      "verification": [
        {
          "check_id": "check-1",
          "recipe_id": "python_tests",
          "requirement_ids": [
            "DEMO-REQ-1"
          ],
          "scenario_ids": [
            "scenario-empty",
            "scenario-normal"
          ],
          "expected_exit_codes": [
            0
          ],
          "required": true,
          "expected_evidence": [
            "실행 명령",
            "postimage digest",
            "JUnit 결과"
          ]
        }
      ],
      "rollback": [
        "작업 사본을 이전 snapshot으로 복원한다. 원본 파일은 자동 변경하지 않는다."
      ],
      "risk": "standard",
      "budget": {
        "max_model_attempts": 32,
        "max_tool_calls": 100,
        "max_seconds": 3600,
        "max_parallel_workers": 3,
        "max_cost_usd": null
      },
      "done_when": [
        "필수 검사와 독립 최종 리뷰를 통과한다."
      ],
      "owner_role": "implementer"
    }
  ],
  "review_roles": [
    "plan_reviewer"
  ],
  "unresolved_items": [],
  "budget": {
    "max_model_attempts": 32,
    "max_tool_calls": 100,
    "max_seconds": 3600,
    "max_parallel_workers": 3,
    "max_cost_usd": null
  },
  "delivery_mode": "patch_only"
}
